{
  "$schema": "http://json-schema.org/draft-07/schema#",
  "type": ["object", "null"],
  "title": "Power Supply Schema",
  "description": "Schema for Power Supply components",
  "required": ["metadata"],
  "properties": {
    "opendb_id": {
      "type": ["string", "null"],
      "description": "Unique identifier for the document (UUID v4)"
    },
    "weight": {
      "description": "Product weight in grams for one complete, usable unit of this exact variant. Exclude retail packaging, shipping materials, multipack totals, and load capacity. Leave unset when the product is digital, the weight is unknown, or the source does not clearly identify product weight.",
      "type": ["number", "null"],
      "exclusiveMinimum": 0
    },
    "wattage": {
      "description": "The total power output of the PSU in watts (e.g., 1000)",
      "type": ["number", "null"]
    },
    "form_factor": {
      "description": "The physical size and shape of the PSU (e.g., ATX)",
      "type": ["string", "null"],
      "enum": ["ATX", "SFX", "SFX-L", "TFX", "Flex ATX", "Mini-ITX", "ATX/EPS", null]
    },
    "efficiency_rating": {
      "description": "The 80 PLUS efficiency certification level (e.g., 80 PLUS Gold)",
      "type": ["string", "null"],
      "enum": [
        "80+ Titanium",
        "80+ Platinum",
        "80+ Gold",
        "80+ Silver",
        "80+ Bronze",
        "80+ Standard",
        "80+ White",
        "80+",
        null
      ]
    },
    "cybernetics_efficiency_rating": {
      "description": "The Cybernetics efficiency rating of the PSU (e.g., Cybenetics Titanium)",
      "type": ["string", "null"],
      "enum": [
        "Cybenetics Diamond",
        "Cybenetics Titanium",
        "Cybenetics Platinum",
        "Cybenetics Gold",
        "Cybenetics Silver",
        "Cybenetics Bronze",
        "Cybenetics Standard",
        null
      ]
    },
    "cybernetics_noise_rating": {
      "description": "The Cybernetics noise rating of the PSU (e.g., Cybernetics A++)",
      "type": ["string", "null"],
      "enum": [
        "Cybenetics A++",
        "Cybenetics A+",
        "Cybenetics A",
        "Cybenetics A-",
        "Cybenetics Standard++",
        "Cybenetics Standard+",
        "Cybenetics Standard",
        null
      ]
    },
    "modular": {
      "description": "The modularity of the PSU cables (e.g., Full, Semi-Modular, Non-Modular)",
      "type": ["string", "null"],
      "enum": ["Full", "Semi-Modular", "Non-Modular", null]
    },
    "color": {
      "description": "The color(s) of this product. Each color of the product should be included in the array. Do not use RGB here to describe lighting; use the Lighting field for RGB, ARGB, display, or fixed-color lighting. Includes the casing color",
      "type": ["array", "null"],
      "items": {
        "type": "string",
        "enum": [
          "BLACK",
          "WHITE",
          "RGB",
          "RED",
          "BLUE",
          "GREEN",
          "GREY",
          "YELLOW",
          "ORANGE",
          "PURPLE",
          "PINK",
          "BROWN",
          "GOLD"
        ]
      }
    },
    "lighting": {
      "description": "Lighting capabilities for this product. Use RGB for non-addressable RGB, ARGB for addressable RGB, Multicolor for non-RGB multi-color lighting, Fixed for a single fixed lighting color, None when the product has no lighting, Display for configurable displays, and Fixed Color Display for displays limited to fixed colors such as black and white.",
      "type": ["array", "null"],
      "items": {
        "type": "string",
        "enum": ["RGB", "ARGB", "Multicolor", "Fixed", "None", "Display", "Fixed Color Display"]
      }
    },
    "length": {
      "description": "The length of the PSU in mm (e.g., 140)",
      "type": ["number", "null"]
    },
    "fanless": {
      "description": "Whether the PSU operates without a fan",
      "type": ["boolean", "null"]
    },
    "connectors": {
      "type": ["object", "null"],
      "properties": {
        "atx_24_pin": {
          "description": "The number of ATX 24-pin (20+4) connectors (main motherboard power)",
          "type": ["number", "null"]
        },
        "eps_8_pin": {
          "description": "The number of EPS12V 8-pin (4+4) connectors (CPU power)",
          "type": ["number", "null"]
        },
        "pcie_12vhpwr": {
          "description": "The number of PCIe 5.0 12VHPWR (12+4) pin connectors (for high-end GPUs). Also referred to as 16-pin (12+4).",
          "type": ["number", "null"]
        },
        "pcie_6_plus_2_pin": {
          "description": "The number of PCIe 6+2-pin connectors (commonly used for GPUs)",
          "type": ["number", "null"]
        },
        "sata": {
          "description": "The number of SATA power connectors",
          "type": ["number", "null"]
        },
        "molex_4_pin": {
          "description": "The number of Molex 4-pin peripheral connectors (for older devices)",
          "type": ["number", "null"]
        },
        "floppy_4_pin": {
          "description": "The number of Floppy 4-pin connectors. Increasingly rare.",
          "type": ["number", "null"]
        }
      }
    },
    "general_product_information": {
      "type": ["object", "null"],
      "description": "General product information and retailer SKUs",
      "properties": {
        "amazon_sku": {
          "type": ["string", "null"],
          "description": "Amazon product SKU"
        },
        "newegg_sku": {
          "type": ["string", "null"],
          "description": "Newegg product SKU"
        },
        "bestbuy_sku": {
          "type": ["number", "null"],
          "description": "Best Buy product SKU"
        },
        "walmart_sku": {
          "type": ["number", "null"],
          "description": "Walmart product SKU"
        },
        "adorama_sku": {
          "type": ["string", "null"],
          "description": "Adorama product SKU"
        },
        "ibuypower_sku": {
          "type": ["string", "null"],
          "description": "iBuyPower product SKU"
        },
        "hyte_sku": {
          "type": ["string", "null"],
          "description": "HYTE product SKU"
        },
        "lttstore_sku": {
          "type": ["string", "null"],
          "description": "LTTStore product SKU"
        },
        "manufacturer_url": {
          "type": ["string", "null"],
          "description": "Official manufacturer product URL"
        }
      }
    },
    "metadata": {
      "type": ["object", "null"],
      "properties": {
        "name": {
          "description": "Full product name",
          "type": ["string", "null"]
        },
        "manufacturer": {
          "description": "Power Supply manufacturer",
          "type": ["string", "null"]
        },
        "part_numbers": {
          "description": "Array of manufacturer's part numbers/SKUs",
          "type": ["array", "null"],
          "items": {
            "type": "string"
          }
        },
        "series": {
          "description": "Product series name The manufacturer's marketed product line / family for the PSU. Manufacturer, wattage (`wattage`), form factor (`form_factor`), modularity (`modular`), and efficiency rating (`efficiency_rating`) are stored separately, so do NOT repeat any of them in the series. Wattage is NEVER part of the series. Examples: 'Corsair RM1000x 1000W 80+ Gold' → series='RMx'. 'Seasonic Prime TX-1600 ATX 3.1' → series='Prime TX'. 'ASUS ROG Loki SFX-L 1000W Platinum' → series='ROG Loki SFX-L'.",
          "type": ["string", "null"]
        },
        "variant": {
          "description": "Specific variant in the series Most PSUs should have an empty variant. Wattage, efficiency rating, form factor, modularity, length, and color are all stored in their own fields. Only fill `variant` when the manufacturer ships a genuinely distinct sub-model under the same series + wattage that needs its own selector — for example a marketed hardware revision (`2024` refresh, `R2`) or an ATX spec refresh sold next to the previous SKU. Examples: 'Corsair RM1000x' → variant=''. 'Corsair RM1000x 2024' → variant='2024'. The variant must be unique within a (manufacturer, series, wattage, manufacturer_color) group; if every PSU in a group ends up with the same value, leave it empty.",
          "type": ["string", "null"]
        },
        "releaseYear": {
          "description": "Year of release",
          "type": ["number", "null"]
        },
        "manufacturer_color": {
          "description": "Manufacturer's official color name for this product variant. The manufacturer's marketed colorway / casing finish name, verbatim. Common values: 'Black', 'White', 'Black / White'. Branded special / collab colorways belong here when the rest of the SKU is identical (e.g., 'Hatsune Miku Edition'). Most stock PSUs are 'Black'. Do NOT put wattage, efficiency, modularity, form factor, or family / model words like 'RMx', 'Prime' in manufacturer_color — those belong in dedicated fields or the series.",
          "type": ["string", "null"]
        },
        "last_manually_spec_verified_at": {
          "type": ["string", "null"],
          "format": "date-time",
          "description": "ISO 8601 timestamp of when the part specs were last manually verified by a human"
        }
      },
      "required": ["name"]
    },
    "identifiers": {
      "type": "object",
      "properties": {
        "version": {
          "type": "integer",
          "exclusiveMinimum": 0,
          "maximum": 9007199254740991,
          "description": "Monotonically increasing identity snapshot version"
        },
        "identifiers": {
          "type": "array",
          "items": {
            "type": "object",
            "properties": {
              "type": {
                "type": "string",
                "enum": ["upc", "ean", "gtin", "mpn"]
              },
              "value": {
                "type": "string",
                "minLength": 1
              },
              "region": {
                "default": "all",
                "type": "string",
                "minLength": 1
              }
            },
            "required": ["type", "value", "region"],
            "additionalProperties": false
          },
          "description": "Canonical product identifiers"
        },
        "retailer_listings": {
          "type": "array",
          "items": {
            "type": "object",
            "properties": {
              "source": {
                "type": "string",
                "minLength": 1
              },
              "channel": {
                "type": "string",
                "minLength": 1
              },
              "source_product_id": {
                "type": "string",
                "minLength": 1
              },
              "pricing_enabled": {
                "type": "boolean"
              },
              "excluded_source_offer_ids": {
                "type": "array",
                "items": {
                  "type": "string",
                  "minLength": 1,
                  "maxLength": 512
                }
              },
              "verified": {
                "type": "boolean"
              }
            },
            "required": ["source", "channel", "source_product_id", "pricing_enabled", "verified"],
            "additionalProperties": false
          },
          "description": "Canonical retailer product listings used for pricing"
        }
      },
      "required": ["version", "identifiers", "retailer_listings"],
      "additionalProperties": false,
      "description": "Current versioned product identity snapshot used for retailer and pricing matching"
    }
  }
}
