{
  "opendb_id": "402a934c-7af2-4318-95b7-0317cfc1007c",
  "wattage": 750,
  "form_factor": "ATX",
  "efficiency_rating": "80+ Gold",
  "modular": "Full",
  "color": ["BLACK"],
  "lighting": [],
  "length": 160,
  "fanless": false,
  "connectors": {
    "atx_24_pin": 1,
    "eps_8_pin": 0,
    "pcie_12vhpwr": 0,
    "pcie_6_plus_2_pin": 0,
    "sata": 9,
    "molex_4_pin": 0,
    "floppy_4_pin": 0
  },
  "metadata": {
    "name": "Corsair RM750x (2018) 750W Fully Modular 80+ Gold Certified",
    "manufacturer": "Corsair",
    "part_numbers": ["CP-9020179-NA", "CP-9020179-EU", "CP-9020092-UK", "CP-9020179-UK"],
    "series": "RM750x",
    "variant": "750W Gold"
  },
  "general_product_information": {},
  "identifiers": {
    "version": 1,
    "identifiers": [
      {
        "type": "ean",
        "value": "0843591034968",
        "region": "all"
      },
      {
        "type": "mpn",
        "value": "CP-9020092-UK",
        "region": "all"
      },
      {
        "type": "mpn",
        "value": "CP-9020179-EU",
        "region": "all"
      },
      {
        "type": "mpn",
        "value": "CP-9020179-NA",
        "region": "all"
      },
      {
        "type": "mpn",
        "value": "CP-9020179-UK",
        "region": "all"
      },
      {
        "type": "upc",
        "value": "843591034968",
        "region": "all"
      }
    ],
    "retailer_listings": [
      {
        "source": "amazon",
        "channel": "au",
        "source_product_id": "B079HGN5QS",
        "pricing_enabled": true,
        "verified": true
      },
      {
        "source": "amazon",
        "channel": "be",
        "source_product_id": "B079HGN5QS",
        "pricing_enabled": true,
        "verified": true
      },
      {
        "source": "amazon",
        "channel": "ca",
        "source_product_id": "B079HGN5QS",
        "pricing_enabled": true,
        "verified": true
      },
      {
        "source": "amazon",
        "channel": "de",
        "source_product_id": "B079HGN5QS",
        "pricing_enabled": true,
        "verified": true
      },
      {
        "source": "amazon",
        "channel": "es",
        "source_product_id": "B079HGN5QS",
        "pricing_enabled": true,
        "verified": true
      },
      {
        "source": "amazon",
        "channel": "fr",
        "source_product_id": "B079HGN5QS",
        "pricing_enabled": true,
        "verified": true
      },
      {
        "source": "amazon",
        "channel": "ie",
        "source_product_id": "B079HGN5QS",
        "pricing_enabled": true,
        "verified": true
      },
      {
        "source": "amazon",
        "channel": "it",
        "source_product_id": "B079HGN5QS",
        "pricing_enabled": true,
        "verified": true
      },
      {
        "source": "amazon",
        "channel": "jp",
        "source_product_id": "B079HGN5QS",
        "pricing_enabled": true,
        "verified": true
      },
      {
        "source": "amazon",
        "channel": "nl",
        "source_product_id": "B079HGN5QS",
        "pricing_enabled": true,
        "verified": true
      },
      {
        "source": "amazon",
        "channel": "pl",
        "source_product_id": "B079HGN5QS",
        "pricing_enabled": true,
        "verified": true
      },
      {
        "source": "amazon",
        "channel": "se",
        "source_product_id": "B079HGN5QS",
        "pricing_enabled": true,
        "verified": true
      },
      {
        "source": "amazon",
        "channel": "sg",
        "source_product_id": "B079HGN5QS",
        "pricing_enabled": true,
        "verified": true
      },
      {
        "source": "amazon",
        "channel": "uk",
        "source_product_id": "B079HGN5QS",
        "pricing_enabled": true,
        "verified": true
      },
      {
        "source": "amazon",
        "channel": "us",
        "source_product_id": "B079HGN5QS",
        "pricing_enabled": true,
        "verified": true
      },
      {
        "source": "cenowarka",
        "channel": "pl",
        "source_product_id": "1777727",
        "pricing_enabled": true,
        "verified": false
      },
      {
        "source": "geizhals",
        "channel": "de",
        "source_product_id": "1777727",
        "pricing_enabled": true,
        "verified": false
      },
      {
        "source": "newegg",
        "channel": "ca",
        "source_product_id": "N82E16817139233",
        "pricing_enabled": true,
        "verified": false
      },
      {
        "source": "newegg",
        "channel": "us",
        "source_product_id": "N82E16817139233",
        "pricing_enabled": true,
        "verified": false
      },
      {
        "source": "skinflint",
        "channel": "uk",
        "source_product_id": "1777727",
        "pricing_enabled": true,
        "verified": false
      },
      {
        "source": "walmart",
        "channel": "us",
        "source_product_id": "569887395",
        "pricing_enabled": true,
        "verified": false
      }
    ]
  }
}
