{
  "opendb_id": "1ffa7bc2-3045-4589-bc8b-db00653fc277",
  "connectors": {
    "atx_24_pin": 1,
    "eps_8_pin": 2,
    "pcie_12vhpwr": 0,
    "pcie_6_plus_2_pin": 3,
    "sata": 10,
    "molex_4_pin": 9,
    "floppy_4_pin": 0
  },
  "metadata": {
    "name": "NZXT HALE 90 850 W 80+ Gold Certified Fully Modular ATX",
    "manufacturer": "NZXT",
    "part_numbers": [
      "HALE90-850-M"
    ],
    "series": "HALE",
    "variant": "850W Gold"
  },
  "wattage": 850,
  "form_factor": "ATX",
  "efficiency_rating": "80+ Gold",
  "modular": "Full",
  "color": "",
  "length": 180,
  "fanless": false,
  "general_product_information": {}
}