{
  "opendb_id": "546d0f74-827d-42bf-b572-f2a03e6849f1",
  "wattage": 700,
  "form_factor": "ATX",
  "efficiency_rating": "80+ Bronze",
  "modular": "Semi-Modular",
  "color": [],
  "lighting": [],
  "length": 165,
  "fanless": false,
  "connectors": {
    "atx_24_pin": 1,
    "eps_8_pin": 1,
    "pcie_12vhpwr": 0,
    "pcie_6_plus_2_pin": 4,
    "sata": 6,
    "molex_4_pin": 4,
    "floppy_4_pin": 0
  },
  "metadata": {
    "name": "Rosewill Glacier 700M 700W Semi-Modular 80+ Bronze Certified",
    "manufacturer": "Rosewill",
    "part_numbers": ["Glacier 700M"],
    "series": "Glacier",
    "variant": "700W Bronze"
  },
  "general_product_information": {},
  "identifiers": {
    "version": 1,
    "identifiers": [
      {
        "type": "mpn",
        "value": "Glacier 700M",
        "region": "all"
      }
    ],
    "retailer_listings": []
  }
}
