{
  "opendb_id": "00bb6732-5fc1-438f-b431-b9d1d2789d56",
  "connectors": {
    "atx_24_pin": 1,
    "eps_8_pin": 2,
    "pcie_12vhpwr": 0,
    "pcie_6_plus_2_pin": 4,
    "sata": 8,
    "molex_4_pin": 5,
    "floppy_4_pin": 0
  },
  "metadata": {
    "name": "XFX 650W Bronze Semi-Modular ATX",
    "manufacturer": "XFX",
    "part_numbers": [
      "P1-650X-XXB9"
    ],
    "series": "P1-650X-XXB9",
    "variant": "650W Bronze"
  },
  "wattage": 650,
  "form_factor": "ATX",
  "efficiency_rating": "80+ Bronze",
  "modular": "Semi-Modular",
  "color": [],
  "length": null,
  "fanless": false,
  "general_product_information": {}
}