{
  "opendb_id": "b4cb386f-eaff-4faa-a53d-a61a00a67355",
  "wattage": 750,
  "form_factor": "ATX",
  "efficiency_rating": "80+ Platinum",
  "modular": "Full",
  "color": [],
  "lighting": [],
  "length": 180,
  "fanless": false,
  "connectors": {
    "atx_24_pin": 1,
    "eps_8_pin": 2,
    "pcie_12vhpwr": 0,
    "pcie_6_plus_2_pin": 6,
    "sata": 12,
    "molex_4_pin": 8,
    "floppy_4_pin": 0
  },
  "metadata": {
    "name": "Corsair HX750i 750W Fully Modular 80+ Platinum",
    "manufacturer": "Corsair",
    "part_numbers": [
      "CP-9020072",
      "CP-9020072-UK",
      "CP-9020072-NA",
      "CP-9020072-EU",
      "CP-9020072-AU"
    ],
    "series": "HX750i",
    "variant": "750W Platinum"
  },
  "general_product_information": {},
  "identifiers": {
    "version": 1,
    "identifiers": [
      {
        "type": "mpn",
        "value": "CP-9020072",
        "region": "all"
      },
      {
        "type": "mpn",
        "value": "CP-9020072-AU",
        "region": "all"
      },
      {
        "type": "mpn",
        "value": "CP-9020072-EU",
        "region": "all"
      },
      {
        "type": "mpn",
        "value": "CP-9020072-NA",
        "region": "all"
      },
      {
        "type": "mpn",
        "value": "CP-9020072-UK",
        "region": "all"
      }
    ],
    "retailer_listings": []
  }
}
