{
  "opendb_id": "bd5e23dd-acbb-4048-9069-dbeb9ac60954",
  "wattage": 1050,
  "form_factor": "ATX",
  "efficiency_rating": "80+ Gold",
  "modular": "Full",
  "color": [],
  "lighting": [],
  "length": 190,
  "fanless": false,
  "connectors": {
    "atx_24_pin": 1,
    "eps_8_pin": 0,
    "pcie_12vhpwr": 0,
    "pcie_6_plus_2_pin": 0,
    "sata": 11,
    "molex_4_pin": 0,
    "floppy_4_pin": 0
  },
  "metadata": {
    "name": "XFX ProSeries ATX 1050W Fully Modular 80+ Gold Certified",
    "manufacturer": "XFX",
    "part_numbers": ["P1-1050-BEFX"],
    "series": "ProSeries",
    "variant": "1050W Gold"
  },
  "general_product_information": {},
  "identifiers": {
    "version": 1,
    "identifiers": [
      {
        "type": "mpn",
        "value": "P1-1050-BEFX",
        "region": "all"
      }
    ],
    "retailer_listings": []
  }
}
