{
  "opendb_id": "e051c69f-13b5-4762-b5c0-14690cab059a",
  "wattage": 850,
  "form_factor": "ATX",
  "efficiency_rating": "80+ Gold",
  "modular": "Full",
  "color": ["BLACK"],
  "lighting": [],
  "length": 160,
  "fanless": false,
  "connectors": {
    "atx_24_pin": 1,
    "eps_8_pin": 2,
    "pcie_12vhpwr": 0,
    "pcie_6_plus_2_pin": 6,
    "sata": 8,
    "molex_4_pin": 5,
    "floppy_4_pin": 0
  },
  "metadata": {
    "name": "MSI MPG A850GF 850W Fully Modular 80+ Gold",
    "manufacturer": "MSI",
    "part_numbers": ["MPG A850GF", "306-7ZP0C11-CE0", "306-7ZP0C18-CE0", "MPGA850GF"],
    "series": "MPG",
    "variant": "850W Gold"
  },
  "general_product_information": {},
  "identifiers": {
    "version": 1,
    "identifiers": [
      {
        "type": "ean",
        "value": "0824142225769",
        "region": "all"
      },
      {
        "type": "mpn",
        "value": "306-7ZP0C11-CE0",
        "region": "all"
      },
      {
        "type": "mpn",
        "value": "306-7ZP0C18-CE0",
        "region": "all"
      },
      {
        "type": "mpn",
        "value": "MPG A850GF",
        "region": "all"
      },
      {
        "type": "mpn",
        "value": "MPGA850GF",
        "region": "all"
      },
      {
        "type": "upc",
        "value": "824142225769",
        "region": "all"
      }
    ],
    "retailer_listings": [
      {
        "source": "amazon",
        "channel": "au",
        "source_product_id": "B08PDZQZN2",
        "pricing_enabled": true,
        "verified": true
      },
      {
        "source": "amazon",
        "channel": "be",
        "source_product_id": "B08PDZQZN2",
        "pricing_enabled": true,
        "verified": true
      },
      {
        "source": "amazon",
        "channel": "ca",
        "source_product_id": "B08PDZQZN2",
        "pricing_enabled": true,
        "verified": true
      },
      {
        "source": "amazon",
        "channel": "de",
        "source_product_id": "B08PDZQZN2",
        "pricing_enabled": true,
        "verified": true
      },
      {
        "source": "amazon",
        "channel": "es",
        "source_product_id": "B08PDZQZN2",
        "pricing_enabled": true,
        "verified": true
      },
      {
        "source": "amazon",
        "channel": "fr",
        "source_product_id": "B08PDZQZN2",
        "pricing_enabled": true,
        "verified": true
      },
      {
        "source": "amazon",
        "channel": "ie",
        "source_product_id": "B08PDZQZN2",
        "pricing_enabled": true,
        "verified": true
      },
      {
        "source": "amazon",
        "channel": "it",
        "source_product_id": "B08PDZQZN2",
        "pricing_enabled": true,
        "verified": true
      },
      {
        "source": "amazon",
        "channel": "jp",
        "source_product_id": "B08PDZQZN2",
        "pricing_enabled": true,
        "verified": true
      },
      {
        "source": "amazon",
        "channel": "nl",
        "source_product_id": "B08PDZQZN2",
        "pricing_enabled": true,
        "verified": true
      },
      {
        "source": "amazon",
        "channel": "pl",
        "source_product_id": "B08PDZQZN2",
        "pricing_enabled": true,
        "verified": true
      },
      {
        "source": "amazon",
        "channel": "se",
        "source_product_id": "B08PDZQZN2",
        "pricing_enabled": true,
        "verified": true
      },
      {
        "source": "amazon",
        "channel": "sg",
        "source_product_id": "B08PDZQZN2",
        "pricing_enabled": true,
        "verified": true
      },
      {
        "source": "amazon",
        "channel": "uk",
        "source_product_id": "B08PDZQZN2",
        "pricing_enabled": true,
        "verified": true
      },
      {
        "source": "amazon",
        "channel": "us",
        "source_product_id": "B08PDZQZN2",
        "pricing_enabled": true,
        "verified": true
      },
      {
        "source": "newegg",
        "channel": "ca",
        "source_product_id": "9SIAJEPK6W7203",
        "pricing_enabled": true,
        "verified": false
      },
      {
        "source": "newegg",
        "channel": "us",
        "source_product_id": "9SIAJEPK6W7203",
        "pricing_enabled": true,
        "verified": false
      },
      {
        "source": "walmart",
        "channel": "us",
        "source_product_id": "649103463",
        "pricing_enabled": true,
        "verified": false
      }
    ]
  }
}
