{
  "opendb_id": "75303385-858f-452e-af62-e6d5bc4681dc",
  "connectors": {
    "atx_24_pin": 1,
    "eps_8_pin": 2,
    "pcie_12vhpwr": 0,
    "pcie_6_plus_2_pin": 4,
    "sata": 12,
    "molex_4_pin": 4,
    "floppy_4_pin": 0
  },
  "metadata": {
    "name": "Cooler Master V Gold 750 W 80+ Gold Certified Fully Modular ATX",
    "manufacturer": "Cooler Master",
    "part_numbers": [
      "MPY-7501-AFAAGV-US"
    ],
    "series": "V",
    "variant": "750W Gold"
  },
  "wattage": 750,
  "form_factor": "ATX",
  "efficiency_rating": "80+ Gold",
  "modular": "Full",
  "color": "Black",
  "length": 160,
  "fanless": false,
  "general_product_information": {}
}