{
  "opendb_id": "b95579ab-1ef7-4bd8-a5e0-88d351cdc104",
  "connectors": {
    "atx_24_pin": 1,
    "eps_8_pin": 2,
    "pcie_12vhpwr": 1,
    "pcie_6_plus_2_pin": 3,
    "sata": 8,
    "molex_4_pin": 4,
    "floppy_4_pin": 0
  },
  "metadata": {
    "name": "Enermax Revolution D.F. 12 750 W 80+ Gold Certified Fully Modular ATX",
    "manufacturer": "Enermax",
    "part_numbers": [
      "ETV750G"
    ],
    "series": "Revolution",
    "variant": "750W Gold"
  },
  "wattage": 750,
  "form_factor": "ATX",
  "efficiency_rating": "80+ Gold",
  "modular": "Full",
  "color": "Black",
  "length": 122,
  "fanless": false,
  "general_product_information": {}
}