{
  "opendb_id": "2347fde7-573a-4261-a305-86a7ba993906",
  "connectors": {
    "atx_24_pin": 1,
    "eps_8_pin": 2,
    "pcie_12vhpwr": 0,
    "pcie_6_plus_2_pin": 4,
    "sata": 8,
    "molex_4_pin": 4,
    "floppy_4_pin": 0
  },
  "metadata": {
    "name": "Super Flower Leadex III Super Pro 750 W 80+ Bronze Certified Fully Modular ATX",
    "manufacturer": "Super Flower",
    "part_numbers": [
      "SF- 750R14HE"
    ],
    "series": "Leadex",
    "variant": "750W Bronze"
  },
  "wattage": 750,
  "form_factor": "ATX",
  "efficiency_rating": "80+ Bronze",
  "modular": "Full",
  "color": "Black",
  "length": 150,
  "fanless": false,
  "general_product_information": {}
}