{
  "opendb_id": "10ac22fb-6ad4-4735-b435-9b38396210b1",
  "connectors": {
    "atx_24_pin": 1,
    "eps_8_pin": 2,
    "pcie_12vhpwr": 0,
    "pcie_6_plus_2_pin": 2,
    "sata": 6,
    "molex_4_pin": 4,
    "floppy_4_pin": 0
  },
  "metadata": {
    "name": "Thermaltake Smart BM2 550 W 80+ Bronze Certified Semi-modular ATX",
    "manufacturer": "Thermaltake",
    "part_numbers": [
      "PS-SPD-0550MNFABU-1                                                    PS-SPD-0550MNFABA-1                                                    PS-SPD-0550MNFABE-1                                                    PS-SPD-0550MNFABK-1"
    ],
    "series": "Smart",
    "variant": "550W Bronze"
  },
  "wattage": 550,
  "form_factor": "ATX",
  "efficiency_rating": "80+ Bronze",
  "modular": "Semi-Modular",
  "color": "Black",
  "length": 160,
  "fanless": false,
  "general_product_information": {}
}