{
  "opendb_id": "f318c11d-4dff-4643-9d20-fc40b8b30206",
  "wattage": 750,
  "form_factor": "ATX",
  "efficiency_rating": "80+ Gold",
  "modular": "Full",
  "color": ["BLACK", "RED"],
  "lighting": [],
  "length": 160,
  "fanless": false,
  "connectors": {
    "atx_24_pin": 1,
    "eps_8_pin": 1,
    "pcie_12vhpwr": 0,
    "pcie_6_plus_2_pin": 4,
    "sata": 9,
    "molex_4_pin": 3,
    "floppy_4_pin": 0
  },
  "metadata": {
    "name": "Chieftec PowerPlay Gold 750W Fully Modular 80+ Gold Certified",
    "manufacturer": "Chieftec",
    "part_numbers": ["GPU-750FC"],
    "series": "PowerPlay",
    "variant": "750W Gold"
  },
  "general_product_information": {},
  "identifiers": {
    "version": 1,
    "identifiers": [
      {
        "type": "mpn",
        "value": "GPU-750FC",
        "region": "all"
      }
    ],
    "retailer_listings": []
  }
}
