{
  "opendb_id": "402a74ec-8423-4c7d-9a09-0bc6d3432dff",
  "wattage": 600,
  "form_factor": "ATX",
  "efficiency_rating": "80+ Gold",
  "modular": "Non-Modular",
  "color": [],
  "lighting": [],
  "length": 139,
  "fanless": false,
  "connectors": {
    "atx_24_pin": 1,
    "eps_8_pin": 1,
    "pcie_12vhpwr": 0,
    "pcie_6_plus_2_pin": 4,
    "sata": 9,
    "molex_4_pin": 3,
    "floppy_4_pin": 0
  },
  "metadata": {
    "name": "FSP Group AURUM S 600W Non-Modular 80+ Gold",
    "manufacturer": "FSP Group",
    "part_numbers": ["AURUM S 600W"],
    "series": "AURUM",
    "variant": "600W Gold"
  },
  "general_product_information": {},
  "identifiers": {
    "version": 1,
    "identifiers": [
      {
        "type": "mpn",
        "value": "AURUM S 600W",
        "region": "all"
      }
    ],
    "retailer_listings": []
  }
}
